{
  "schema_version": "1.0",
  "taxonomy_version": "1.0",
  "views": {
    "front": {
      "view_box": [
        0,
        0,
        35,
        93
      ],
      "source_svg": "design/anatomy/front.svg"
    },
    "back": {
      "view_box": [
        37,
        0,
        35,
        93
      ],
      "source_svg": "design/anatomy/back.svg"
    }
  },
  "regions": [
    {
      "region_id": "neck-right",
      "view": "front",
      "path_ids": [
        "neck-right"
      ],
      "subdivision_ids": [
        "sternocleidomastoid"
      ],
      "mapping_precision": "approximation",
      "license_source": "vulovix/body-muscles@15c8085ee97cb94c51f92c75224416b15f955b5c",
      "notes": "Source shape combines or approximates the canonical subdivision; indicator only, not an independent muscle measurement."
    },
    {
      "region_id": "neck-left",
      "view": "front",
      "path_ids": [
        "neck-left"
      ],
      "subdivision_ids": [
        "sternocleidomastoid"
      ],
      "mapping_precision": "approximation",
      "license_source": "vulovix/body-muscles@15c8085ee97cb94c51f92c75224416b15f955b5c",
      "notes": "Source shape combines or approximates the canonical subdivision; indicator only, not an independent muscle measurement."
    },
    {
      "region_id": "shoulder-front-left",
      "view": "front",
      "path_ids": [
        "shoulder-front-left"
      ],
      "subdivision_ids": [
        "deltoid_anterior"
      ],
      "mapping_precision": "exact_visual",
      "license_source": "vulovix/body-muscles@15c8085ee97cb94c51f92c75224416b15f955b5c",
      "notes": "Source shape labels correspond to the canonical visual region."
    },
    {
      "region_id": "shoulder-side-left",
      "view": "front",
      "path_ids": [
        "shoulder-side-left"
      ],
      "subdivision_ids": [
        "deltoid_lateral"
      ],
      "mapping_precision": "exact_visual",
      "license_source": "vulovix/body-muscles@15c8085ee97cb94c51f92c75224416b15f955b5c",
      "notes": "Source shape labels correspond to the canonical visual region."
    },
    {
      "region_id": "shoulder-front-right",
      "view": "front",
      "path_ids": [
        "shoulder-front-right"
      ],
      "subdivision_ids": [
        "deltoid_anterior"
      ],
      "mapping_precision": "exact_visual",
      "license_source": "vulovix/body-muscles@15c8085ee97cb94c51f92c75224416b15f955b5c",
      "notes": "Source shape labels correspond to the canonical visual region."
    },
    {
      "region_id": "shoulder-side-right",
      "view": "front",
      "path_ids": [
        "shoulder-side-right"
      ],
      "subdivision_ids": [
        "deltoid_lateral"
      ],
      "mapping_precision": "exact_visual",
      "license_source": "vulovix/body-muscles@15c8085ee97cb94c51f92c75224416b15f955b5c",
      "notes": "Source shape labels correspond to the canonical visual region."
    },
    {
      "region_id": "biceps-left",
      "view": "front",
      "path_ids": [
        "biceps-left"
      ],
      "subdivision_ids": [
        "biceps_long"
      ],
      "mapping_precision": "approximation",
      "license_source": "vulovix/body-muscles@15c8085ee97cb94c51f92c75224416b15f955b5c",
      "notes": "Source shape combines or approximates the canonical subdivision; indicator only, not an independent muscle measurement."
    },
    {
      "region_id": "forearm-left",
      "view": "front",
      "path_ids": [
        "forearm-left"
      ],
      "subdivision_ids": [
        "brachioradialis"
      ],
      "mapping_precision": "approximation",
      "license_source": "vulovix/body-muscles@15c8085ee97cb94c51f92c75224416b15f955b5c",
      "notes": "Source shape combines or approximates the canonical subdivision; indicator only, not an independent muscle measurement."
    },
    {
      "region_id": "biceps-right",
      "view": "front",
      "path_ids": [
        "biceps-right"
      ],
      "subdivision_ids": [
        "biceps_long"
      ],
      "mapping_precision": "approximation",
      "license_source": "vulovix/body-muscles@15c8085ee97cb94c51f92c75224416b15f955b5c",
      "notes": "Source shape combines or approximates the canonical subdivision; indicator only, not an independent muscle measurement."
    },
    {
      "region_id": "forearm-right",
      "view": "front",
      "path_ids": [
        "forearm-right"
      ],
      "subdivision_ids": [
        "brachioradialis"
      ],
      "mapping_precision": "approximation",
      "license_source": "vulovix/body-muscles@15c8085ee97cb94c51f92c75224416b15f955b5c",
      "notes": "Source shape combines or approximates the canonical subdivision; indicator only, not an independent muscle measurement."
    },
    {
      "region_id": "chest-upper-left",
      "view": "front",
      "path_ids": [
        "chest-upper-left"
      ],
      "subdivision_ids": [
        "chest_clavicular"
      ],
      "mapping_precision": "exact_visual",
      "license_source": "vulovix/body-muscles@15c8085ee97cb94c51f92c75224416b15f955b5c",
      "notes": "Source shape labels correspond to the canonical visual region."
    },
    {
      "region_id": "chest-lower-left",
      "view": "front",
      "path_ids": [
        "chest-lower-left"
      ],
      "subdivision_ids": [
        "chest_sternocostal"
      ],
      "mapping_precision": "approximation",
      "license_source": "vulovix/body-muscles@15c8085ee97cb94c51f92c75224416b15f955b5c",
      "notes": "Source shape combines or approximates the canonical subdivision; indicator only, not an independent muscle measurement."
    },
    {
      "region_id": "chest-upper-right",
      "view": "front",
      "path_ids": [
        "chest-upper-right"
      ],
      "subdivision_ids": [
        "chest_clavicular"
      ],
      "mapping_precision": "exact_visual",
      "license_source": "vulovix/body-muscles@15c8085ee97cb94c51f92c75224416b15f955b5c",
      "notes": "Source shape labels correspond to the canonical visual region."
    },
    {
      "region_id": "chest-lower-right",
      "view": "front",
      "path_ids": [
        "chest-lower-right"
      ],
      "subdivision_ids": [
        "chest_sternocostal"
      ],
      "mapping_precision": "approximation",
      "license_source": "vulovix/body-muscles@15c8085ee97cb94c51f92c75224416b15f955b5c",
      "notes": "Source shape combines or approximates the canonical subdivision; indicator only, not an independent muscle measurement."
    },
    {
      "region_id": "abs-upper-left",
      "view": "front",
      "path_ids": [
        "abs-upper-left"
      ],
      "subdivision_ids": [
        "rectus_abdominis_upper"
      ],
      "mapping_precision": "exact_visual",
      "license_source": "vulovix/body-muscles@15c8085ee97cb94c51f92c75224416b15f955b5c",
      "notes": "Source shape labels correspond to the canonical visual region."
    },
    {
      "region_id": "serratus-anterior-left",
      "view": "front",
      "path_ids": [
        "serratus-anterior-left"
      ],
      "subdivision_ids": [
        "serratus_anterior"
      ],
      "mapping_precision": "exact_visual",
      "license_source": "vulovix/body-muscles@15c8085ee97cb94c51f92c75224416b15f955b5c",
      "notes": "Source shape labels correspond to the canonical visual region."
    },
    {
      "region_id": "obliques-left",
      "view": "front",
      "path_ids": [
        "obliques-left"
      ],
      "subdivision_ids": [
        "obliques"
      ],
      "mapping_precision": "exact_visual",
      "license_source": "vulovix/body-muscles@15c8085ee97cb94c51f92c75224416b15f955b5c",
      "notes": "Source shape labels correspond to the canonical visual region."
    },
    {
      "region_id": "abs-upper-right",
      "view": "front",
      "path_ids": [
        "abs-upper-right"
      ],
      "subdivision_ids": [
        "rectus_abdominis_upper"
      ],
      "mapping_precision": "exact_visual",
      "license_source": "vulovix/body-muscles@15c8085ee97cb94c51f92c75224416b15f955b5c",
      "notes": "Source shape labels correspond to the canonical visual region."
    },
    {
      "region_id": "abs-lower-right",
      "view": "front",
      "path_ids": [
        "abs-lower-right"
      ],
      "subdivision_ids": [
        "rectus_abdominis_lower"
      ],
      "mapping_precision": "exact_visual",
      "license_source": "vulovix/body-muscles@15c8085ee97cb94c51f92c75224416b15f955b5c",
      "notes": "Source shape labels correspond to the canonical visual region."
    },
    {
      "region_id": "abs-lower-left",
      "view": "front",
      "path_ids": [
        "abs-lower-left"
      ],
      "subdivision_ids": [
        "rectus_abdominis_lower"
      ],
      "mapping_precision": "exact_visual",
      "license_source": "vulovix/body-muscles@15c8085ee97cb94c51f92c75224416b15f955b5c",
      "notes": "Source shape labels correspond to the canonical visual region."
    },
    {
      "region_id": "serratus-anterior-right",
      "view": "front",
      "path_ids": [
        "serratus-anterior-right"
      ],
      "subdivision_ids": [
        "serratus_anterior"
      ],
      "mapping_precision": "exact_visual",
      "license_source": "vulovix/body-muscles@15c8085ee97cb94c51f92c75224416b15f955b5c",
      "notes": "Source shape labels correspond to the canonical visual region."
    },
    {
      "region_id": "obliques-right",
      "view": "front",
      "path_ids": [
        "obliques-right"
      ],
      "subdivision_ids": [
        "obliques"
      ],
      "mapping_precision": "exact_visual",
      "license_source": "vulovix/body-muscles@15c8085ee97cb94c51f92c75224416b15f955b5c",
      "notes": "Source shape labels correspond to the canonical visual region."
    },
    {
      "region_id": "hip-flexor-right",
      "view": "front",
      "path_ids": [
        "hip-flexor-right"
      ],
      "subdivision_ids": [
        "iliopsoas"
      ],
      "mapping_precision": "approximation",